{
  "$schema": "https://json-schema.org/draft/2020-12/schema",
  "$id": "urn:lsc:rule-set:1.0.4",
  "title": "LSC Rule Set (contract 1.0.4)",
  "$comment": "GENERATED by `npm run contract:export` from src/contract/schema.ts. Do not edit by hand. Cross-field rules that JSON Schema cannot express are listed in contract/CONTRACT.md §5; run `lsc validate-ruleset` or reimplement them.",
  "type": "object",
  "properties": {
    "contractVersion": {
      "type": "string",
      "pattern": "^1\\.0\\.(?:0|[1-9]\\d*)$",
      "description": "Version of the Rule Set format. This schema implements 1.0.4 and accepts 1.0.x."
    },
    "languageId": {
      "type": "string",
      "pattern": "^\\S+$",
      "description": "Language identifier."
    },
    "version": {
      "type": "string",
      "pattern": "^(?:0|[1-9]\\d*)\\.(?:0|[1-9]\\d*)\\.(?:0|[1-9]\\d*)(?:-(?:(?:0|[1-9]\\d*|\\d*[a-zA-Z-][a-zA-Z0-9-]*)(?:\\.(?:0|[1-9]\\d*|\\d*[a-zA-Z-][a-zA-Z0-9-]*))*))?(?:\\+[0-9a-zA-Z-]+(?:\\.[0-9a-zA-Z-]+)*)?$",
      "description": "Version of this rule content (semver; bump rules in CONTRACT.md §3)."
    },
    "compiledAt": {
      "type": "string",
      "format": "date-time",
      "pattern": "^(?:(?:\\d\\d[2468][048]|\\d\\d[13579][26]|\\d\\d0[48]|[02468][048]00|[13579][26]00)-02-29|\\d{4}-(?:(?:0[13578]|1[02])-(?:0[1-9]|[12]\\d|3[01])|(?:0[469]|11)-(?:0[1-9]|[12]\\d|30)|(?:02)-(?:0[1-9]|1\\d|2[0-8])))T(?:(?:[01]\\d|2[0-3]):[0-5]\\d:[0-5]\\d(?:\\.\\d+)?(?:Z))$",
      "description": "Compile time, ISO 8601 in UTC (suffix Z)."
    },
    "compilerVersion": {
      "type": "string",
      "pattern": "^(?:0|[1-9]\\d*)\\.(?:0|[1-9]\\d*)\\.(?:0|[1-9]\\d*)(?:-(?:(?:0|[1-9]\\d*|\\d*[a-zA-Z-][a-zA-Z0-9-]*)(?:\\.(?:0|[1-9]\\d*|\\d*[a-zA-Z-][a-zA-Z0-9-]*))*))?(?:\\+[0-9a-zA-Z-]+(?:\\.[0-9a-zA-Z-]+)*)?$",
      "description": "Version of the lsc build that produced the file."
    },
    "sourceSkills": {
      "type": "array",
      "items": {
        "type": "object",
        "properties": {
          "path": {
            "type": "string",
            "minLength": 1,
            "description": "Skill file path, relative to the Skill directory, with forward slashes."
          },
          "sha256": {
            "type": "string",
            "pattern": "^[0-9a-f]{64}$",
            "description": "SHA-256 of the file bytes, lowercase hex."
          }
        },
        "required": [
          "path",
          "sha256"
        ],
        "additionalProperties": false
      },
      "description": "Exact Skill file inputs used."
    },
    "fileMatchers": {
      "minItems": 1,
      "type": "array",
      "items": {
        "type": "string",
        "minLength": 1
      },
      "description": "Glob patterns (forward slashes, relative to the repository root) of files the Rule Set applies to."
    },
    "lineComment": {
      "description": "Line comment marker; the comment runs to end of line.",
      "type": "string",
      "minLength": 1
    },
    "blockComment": {
      "description": "Block comment start and end markers (not nested).",
      "$ref": "#/$defs/DelimiterPair"
    },
    "stringDelimiters": {
      "description": "String literal delimiters. No escape sequences in contract 1.0.",
      "type": "array",
      "items": {
        "$ref": "#/$defs/DelimiterPair"
      }
    },
    "rules": {
      "type": "array",
      "items": {
        "$ref": "#/$defs/Rule"
      },
      "description": "The rules. Only rules with status validated are applied."
    }
  },
  "required": [
    "contractVersion",
    "languageId",
    "version",
    "compiledAt",
    "compilerVersion",
    "sourceSkills",
    "fileMatchers",
    "rules"
  ],
  "additionalProperties": false,
  "description": "Language Skill Compiler Rule Set: the contract with Legacy Navigator.",
  "$defs": {
    "DelimiterPair": {
      "type": "object",
      "properties": {
        "start": {
          "type": "string",
          "minLength": 1
        },
        "end": {
          "type": "string",
          "minLength": 1
        }
      },
      "required": [
        "start",
        "end"
      ],
      "additionalProperties": false,
      "description": "Start and end marker."
    },
    "Rule": {
      "oneOf": [
        {
          "$ref": "#/$defs/ExactRule"
        },
        {
          "$ref": "#/$defs/RegexRule"
        }
      ],
      "description": "One deterministic rule. `engine` selects which engine configuration is present."
    },
    "ExactRule": {
      "type": "object",
      "properties": {
        "id": {
          "type": "string",
          "pattern": "^[a-z][a-z0-9]*(?:-[a-z0-9]+)*$",
          "description": "Stable kebab-case identifier, unique within the Rule Set."
        },
        "type": {
          "$ref": "#/$defs/RuleType"
        },
        "engine": {
          "type": "string",
          "const": "exact"
        },
        "exact": {
          "$ref": "#/$defs/ExactConfig"
        },
        "captures": {
          "$ref": "#/$defs/Captures"
        },
        "blockEnd": {
          "description": "Closes the scope opened by this definition (D4). Only on module_declaration and symbol_definition.",
          "$ref": "#/$defs/RegexConfig"
        },
        "searchStrings": {
          "description": "Default false. true: the rule also matches inside string literals (strings are not masked for it).",
          "type": "boolean"
        },
        "confidence": {
          "type": "string",
          "enum": [
            "high",
            "medium",
            "low"
          ],
          "description": "Computed by the fixed formula in docs/PLAN.md §6.3 (D8); never model-assigned."
        },
        "sourceEvidence": {
          "minItems": 1,
          "type": "array",
          "items": {
            "$ref": "#/$defs/SourceEvidence"
          },
          "description": "At least one provenance entry."
        },
        "tests": {
          "$ref": "#/$defs/RuleTests"
        },
        "status": {
          "type": "string",
          "enum": [
            "validated",
            "rejected"
          ],
          "description": "Only validated rules are exported; consumers must ignore rejected rules."
        }
      },
      "required": [
        "id",
        "type",
        "engine",
        "exact",
        "captures",
        "confidence",
        "sourceEvidence",
        "tests",
        "status"
      ],
      "additionalProperties": false,
      "description": "Rule using the exact (token sequence) engine."
    },
    "RuleType": {
      "type": "string",
      "enum": [
        "module_declaration",
        "symbol_definition",
        "call",
        "include",
        "db_read",
        "db_write",
        "config_ref",
        "entry_point"
      ],
      "description": "What the rule detects; determines the Navigator record (see RULE_TYPE_SPEC)."
    },
    "ExactConfig": {
      "type": "object",
      "properties": {
        "tokens": {
          "minItems": 1,
          "type": "array",
          "items": {
            "type": "string",
            "pattern": "^\\S+$"
          },
          "description": "Token sequence matched on one line. A token written exactly as (?<name>) is a capture placeholder."
        },
        "caseSensitive": {
          "type": "boolean",
          "description": "false: literal tokens match case-insensitively (RE2 flag i)."
        }
      },
      "required": [
        "tokens",
        "caseSensitive"
      ],
      "additionalProperties": false,
      "description": "Exact engine configuration (contract/CONTRACT.md §6.4)."
    },
    "Captures": {
      "type": "object",
      "propertyNames": {
        "$ref": "#/$defs/CaptureRole"
      },
      "additionalProperties": {
        "type": "string",
        "pattern": "^[A-Za-z_][A-Za-z0-9_]*$"
      },
      "description": "Capture role → named group in the pattern (or placeholder in exact tokens). Must include the roles required by the rule type."
    },
    "CaptureRole": {
      "type": "string",
      "enum": [
        "name",
        "kind",
        "callee",
        "module",
        "target",
        "table",
        "key"
      ],
      "description": "Role of a captured value; allowed roles depend on the rule type."
    },
    "RegexConfig": {
      "type": "object",
      "properties": {
        "pattern": {
          "type": "string",
          "minLength": 1,
          "description": "RE2-compatible pattern (D3). Named groups use the (?<name>...) form (D2)."
        },
        "flags": {
          "type": "string",
          "pattern": "^i?m?s?$",
          "description": "Subset of \"ims\" in that order: i case-insensitive, m ^/$ at line breaks, s dot matches newline."
        },
        "multiline": {
          "type": "boolean",
          "description": "false: applied to each line separately; true: applied to the whole file text."
        }
      },
      "required": [
        "pattern",
        "flags",
        "multiline"
      ],
      "additionalProperties": false,
      "description": "RE2 regex configuration (contract/CONTRACT.md §6.4)."
    },
    "SourceEvidence": {
      "type": "object",
      "properties": {
        "skill": {
          "type": "string",
          "minLength": 1,
          "description": "Skill file path, relative to the Skill directory, with forward slashes."
        },
        "anchor": {
          "type": "string",
          "minLength": 1,
          "description": "Section anchor (heading slug) inside the Skill file."
        },
        "exampleIds": {
          "type": "array",
          "items": {
            "type": "string",
            "minLength": 1
          },
          "description": "IDs of the examples that justify the rule."
        }
      },
      "required": [
        "skill",
        "anchor",
        "exampleIds"
      ],
      "additionalProperties": false,
      "description": "Provenance: where the rule comes from."
    },
    "RuleTests": {
      "type": "object",
      "properties": {
        "passed": {
          "type": "integer",
          "minimum": 0,
          "maximum": 9007199254740991,
          "description": "Examples passed in the last validation."
        },
        "failed": {
          "type": "integer",
          "minimum": 0,
          "maximum": 9007199254740991,
          "description": "Examples failed in the last validation."
        },
        "failingExampleIds": {
          "type": "array",
          "items": {
            "type": "string",
            "minLength": 1
          },
          "description": "IDs of the failing examples."
        }
      },
      "required": [
        "passed",
        "failed",
        "failingExampleIds"
      ],
      "additionalProperties": false,
      "description": "Result of the last validation run (docs/PLAN.md §6.2)."
    },
    "RegexRule": {
      "type": "object",
      "properties": {
        "id": {
          "type": "string",
          "pattern": "^[a-z][a-z0-9]*(?:-[a-z0-9]+)*$",
          "description": "Stable kebab-case identifier, unique within the Rule Set."
        },
        "type": {
          "$ref": "#/$defs/RuleType"
        },
        "engine": {
          "type": "string",
          "const": "regex"
        },
        "regex": {
          "$ref": "#/$defs/RegexConfig"
        },
        "captures": {
          "$ref": "#/$defs/Captures"
        },
        "blockEnd": {
          "description": "Closes the scope opened by this definition (D4). Only on module_declaration and symbol_definition.",
          "$ref": "#/$defs/RegexConfig"
        },
        "searchStrings": {
          "description": "Default false. true: the rule also matches inside string literals (strings are not masked for it).",
          "type": "boolean"
        },
        "confidence": {
          "type": "string",
          "enum": [
            "high",
            "medium",
            "low"
          ],
          "description": "Computed by the fixed formula in docs/PLAN.md §6.3 (D8); never model-assigned."
        },
        "sourceEvidence": {
          "minItems": 1,
          "type": "array",
          "items": {
            "$ref": "#/$defs/SourceEvidence"
          },
          "description": "At least one provenance entry."
        },
        "tests": {
          "$ref": "#/$defs/RuleTests"
        },
        "status": {
          "type": "string",
          "enum": [
            "validated",
            "rejected"
          ],
          "description": "Only validated rules are exported; consumers must ignore rejected rules."
        }
      },
      "required": [
        "id",
        "type",
        "engine",
        "regex",
        "captures",
        "confidence",
        "sourceEvidence",
        "tests",
        "status"
      ],
      "additionalProperties": false,
      "description": "Rule using the RE2 regex engine."
    }
  }
}
