{
  "contractVersion": "1.0.0",
  "languageId": "toylang",
  "version": "1.0.0",
  "compiledAt": "2026-09-24T00:00:00Z",
  "compilerVersion": "0.1.0",
  "sourceSkills": [
    {
      "path": "skills/language-basics.md",
      "sha256": "d96e4e99404e5bcea7dfc580dd5ca36aea4c38fe3b09fe4fe973ec77fe55b469"
    },
    {
      "path": "skills/module.md",
      "sha256": "8726ba9efff6553b38536488a6b94ade71cdcec50ed76506de9550e49b04d426"
    },
    {
      "path": "skills/procedure.md",
      "sha256": "55994bb01a2f5dfc6d74d3846a958958ae55de8eebee4175106715047dcf7411"
    },
    {
      "path": "skills/call.md",
      "sha256": "b2e134f5075a6ef524d9d9924da4082b5b31ca3980a807141840dbb1369e91bd"
    },
    {
      "path": "skills/include.md",
      "sha256": "c2ffba25e7c1daf670b60c9a6b2a3474618da0d8467c0b2ec3e8dcdcf7317011"
    },
    {
      "path": "skills/db-read.md",
      "sha256": "51ee4a22f0c1f80c03bac0412ad260cdab4c60ae6e6262a5e03bf88394e65971"
    },
    {
      "path": "skills/db-write.md",
      "sha256": "45a60588788bbce069eb6b24566f5a7828749d7ff4aa16f24f0a8318d4b5a3fe"
    },
    {
      "path": "skills/config-flag.md",
      "sha256": "ea9696b64b82100786b84303cddf86cf1ead527c13d85c9ae8153c7b84ffc6c9"
    },
    {
      "path": "skills/entry-point.md",
      "sha256": "1f3d265af107947941089481aa3fec7d9c115e3857e99ef7dc4b4a9ef588140c"
    }
  ],
  "fileMatchers": [
    "**/*.tl"
  ],
  "lineComment": "--",
  "blockComment": {
    "start": "/*",
    "end": "*/"
  },
  "stringDelimiters": [
    {
      "start": "\"",
      "end": "\""
    }
  ],
  "rules": [
    {
      "id": "module-declaration",
      "type": "module_declaration",
      "engine": "exact",
      "exact": {
        "tokens": [
          "MODULE",
          "(?<name>)"
        ],
        "caseSensitive": false
      },
      "captures": {
        "name": "name"
      },
      "confidence": "high",
      "sourceEvidence": [
        {
          "skill": "skills/module.md",
          "anchor": "declaring-a-module",
          "exampleIds": [
            "module-01",
            "module-02",
            "module-03",
            "module-04",
            "module-05",
            "module-06",
            "module-neg-01",
            "module-neg-02",
            "module-neg-03"
          ]
        }
      ],
      "tests": {
        "passed": 9,
        "failed": 0,
        "failingExampleIds": []
      },
      "status": "validated"
    },
    {
      "id": "proc-definition",
      "type": "symbol_definition",
      "engine": "regex",
      "regex": {
        "pattern": "^\\s*(?<kind>PROC|FUNC)\\s+(?<name>[A-Za-z_][A-Za-z0-9_]*)",
        "flags": "i",
        "multiline": false
      },
      "captures": {
        "name": "name",
        "kind": "kind"
      },
      "blockEnd": {
        "pattern": "^\\s*END(?:PROC|FUNC)\\b",
        "flags": "i",
        "multiline": false
      },
      "confidence": "high",
      "sourceEvidence": [
        {
          "skill": "skills/procedure.md",
          "anchor": "defining-a-procedure",
          "exampleIds": [
            "proc-01",
            "proc-02",
            "proc-03",
            "proc-04",
            "proc-05",
            "proc-06",
            "proc-neg-01",
            "proc-neg-02",
            "proc-neg-03"
          ]
        }
      ],
      "tests": {
        "passed": 9,
        "failed": 0,
        "failingExampleIds": []
      },
      "status": "validated"
    },
    {
      "id": "call-statement",
      "type": "call",
      "engine": "regex",
      "regex": {
        "pattern": "\\bCALL\\s+(?:(?<module>[A-Za-z_][A-Za-z0-9_]*)\\.)?(?<callee>[A-Za-z_][A-Za-z0-9_]*)\\s*\\(",
        "flags": "i",
        "multiline": false
      },
      "captures": {
        "callee": "callee",
        "module": "module"
      },
      "confidence": "high",
      "sourceEvidence": [
        {
          "skill": "skills/call.md",
          "anchor": "calling-a-procedure",
          "exampleIds": [
            "call-01",
            "call-02",
            "call-03",
            "call-04",
            "call-05",
            "call-06",
            "call-07",
            "call-neg-01",
            "call-neg-02",
            "call-neg-03"
          ]
        }
      ],
      "tests": {
        "passed": 10,
        "failed": 0,
        "failingExampleIds": []
      },
      "status": "validated"
    },
    {
      "id": "include-directive",
      "type": "include",
      "engine": "regex",
      "regex": {
        "pattern": "^\\s*INCLUDE\\s+\"(?<target>[^\"]+)\"",
        "flags": "i",
        "multiline": false
      },
      "captures": {
        "target": "target"
      },
      "searchStrings": true,
      "confidence": "high",
      "sourceEvidence": [
        {
          "skill": "skills/include.md",
          "anchor": "including-a-file",
          "exampleIds": [
            "include-01",
            "include-02",
            "include-03",
            "include-04",
            "include-05",
            "include-06",
            "include-neg-01",
            "include-neg-02",
            "include-neg-03"
          ]
        }
      ],
      "tests": {
        "passed": 9,
        "failed": 0,
        "failingExampleIds": []
      },
      "status": "validated"
    },
    {
      "id": "db-read",
      "type": "db_read",
      "engine": "regex",
      "regex": {
        "pattern": "\\bREAD\\s+(?:&\\s+)?(?<table>[A-Za-z_][A-Za-z0-9_]*)",
        "flags": "i",
        "multiline": true
      },
      "captures": {
        "table": "table"
      },
      "confidence": "high",
      "sourceEvidence": [
        {
          "skill": "skills/db-read.md",
          "anchor": "reading-a-table",
          "exampleIds": [
            "read-01",
            "read-02",
            "read-03",
            "read-04",
            "read-05",
            "read-06",
            "read-07",
            "read-neg-01",
            "read-neg-02",
            "read-neg-03"
          ]
        }
      ],
      "tests": {
        "passed": 10,
        "failed": 0,
        "failingExampleIds": []
      },
      "status": "validated"
    },
    {
      "id": "db-write",
      "type": "db_write",
      "engine": "regex",
      "regex": {
        "pattern": "\\bWRITE\\s+(?<table>[A-Za-z_][A-Za-z0-9_]*)",
        "flags": "i",
        "multiline": false
      },
      "captures": {
        "table": "table"
      },
      "confidence": "high",
      "sourceEvidence": [
        {
          "skill": "skills/db-write.md",
          "anchor": "writing-a-table",
          "exampleIds": [
            "write-01",
            "write-02",
            "write-03",
            "write-04",
            "write-05",
            "write-06",
            "write-neg-01",
            "write-neg-02",
            "write-neg-03"
          ]
        }
      ],
      "tests": {
        "passed": 9,
        "failed": 0,
        "failingExampleIds": []
      },
      "status": "validated"
    },
    {
      "id": "config-flag",
      "type": "config_ref",
      "engine": "regex",
      "regex": {
        "pattern": "\\bFLAG\\s*\\(\\s*\"(?<key>[^\"]+)\"\\s*\\)",
        "flags": "i",
        "multiline": false
      },
      "captures": {
        "key": "key"
      },
      "searchStrings": true,
      "confidence": "high",
      "sourceEvidence": [
        {
          "skill": "skills/config-flag.md",
          "anchor": "feature-flags",
          "exampleIds": [
            "flag-01",
            "flag-02",
            "flag-03",
            "flag-04",
            "flag-05",
            "flag-06",
            "flag-neg-01",
            "flag-neg-02",
            "flag-neg-03"
          ]
        }
      ],
      "tests": {
        "passed": 9,
        "failed": 0,
        "failingExampleIds": []
      },
      "status": "validated"
    },
    {
      "id": "entry-point",
      "type": "entry_point",
      "engine": "exact",
      "exact": {
        "tokens": [
          "ENTRY",
          "(?<name>)",
          "->"
        ],
        "caseSensitive": false
      },
      "captures": {
        "name": "name"
      },
      "confidence": "high",
      "sourceEvidence": [
        {
          "skill": "skills/entry-point.md",
          "anchor": "declaring-an-entry-point",
          "exampleIds": [
            "entry-01",
            "entry-02",
            "entry-03",
            "entry-04",
            "entry-05",
            "entry-06",
            "entry-neg-01",
            "entry-neg-02",
            "entry-neg-03"
          ]
        }
      ],
      "tests": {
        "passed": 9,
        "failed": 0,
        "failingExampleIds": []
      },
      "status": "validated"
    }
  ]
}
